{
  "version": "0.1",
  "requestId": "role-tab-states-20260803",
  "agentRole": "state-modeling",
  "inputDigest": "843c5562492ee7a28c5c00456222c227ceddfa2f57054a7cfa9419b6ec098640",
  "contextDigest": "08272bb93ca766906c51cb380f4cfd3d21b03a0fc16aa5c4d852e46f5959e561",
  "sourceScope": [],
  "findings": [],
  "evidence": [],
  "questionCandidates": []
}
